{"type":"config","name":"multi-corpus-quality","metricName":"quality_score","metricUnit":"points","bestDirection":"higher","maxExperiments":100}
{"commit":"6005dbe","metric":64.17,"status":"keep","description":"baseline: MDN+GitHub 30q, recall=0.80, MRR=0.48","metrics":{},"timestamp":1773667936}
{"commit":"4b8ed8a","metric":63.89,"status":"discard","description":"BM25+vec top_k=100: no gain, slight MRR drop","metrics":{},"timestamp":1773668075}
{"commit":"4b8ed8a","metric":68.11,"status":"keep","description":"bm25_weight 1.5->2.0: recall 0.80->0.83, MRR 0.48->0.53","metrics":{},"timestamp":1773668105}
{"commit":"9a63710","metric":71.17,"status":"keep","description":"bm25_weight=2.5: MRR 0.53->0.59","metrics":{},"timestamp":1773668122}
{"commit":"3602511","metric":73.17,"status":"keep","description":"bm25_weight=3.0: recall 0.83->0.87","metrics":{},"timestamp":1773668140}
{"commit":"b646ce4","metric":74.36,"status":"keep","description":"bm25_weight=4.0: MRR 0.60->0.62","metrics":{},"timestamp":1773668156}
{"commit":"eeb6c02","metric":73.06,"status":"discard","description":"bm25_weight=5.0: recall regression 0.87->0.83","metrics":{},"timestamp":1773668176}
{"commit":"eeb6c02","metric":69.50,"status":"discard","description":"path boost 0.40: regression, overboosts path-matching files","metrics":{},"timestamp":1773668200}
{"commit":"eeb6c02","metric":75.81,"status":"keep","description":"file-level chunk aggregation +0.005/extra chunk: recall 0.87->0.90","metrics":{},"timestamp":1773668242}
{"commit":"9aa204a","metric":77.83,"status":"keep","description":"file agg 0.01: MRR 0.62->0.66","metrics":{},"timestamp":1773668261}
{"commit":"00b0d15","metric":78.11,"status":"keep","description":"RRF k=10: slight MRR improvement","metrics":{},"timestamp":1773668285}
{"commit":"4127082","metric":74.31,"status":"discard","description":"NEAR 8: regression, too loose proximity","metrics":{},"timestamp":1773668312}
{"commit":"4127082","metric":78.11,"status":"discard","description":"headroom 20x/10x: no change","metrics":{},"timestamp":1773668359}
{"commit":"4127082","metric":78.25,"status":"discard","description":"BM25+vec top_k=100: marginal, 3 misses unchanged","metrics":{},"timestamp":1773668413}
{"commit":"4127082","metric":77.56,"status":"discard","description":"YAML title extraction: fixes 1 miss but regresses another, net negative","metrics":{},"timestamp":1773668488}
{"commit":"4127082","metric":76.36,"status":"discard","description":"strip frontmatter + YAML title: recall regression, lost 3K chunks","metrics":{},"timestamp":1773668556}
{"commit":"4127082","metric":78.11,"status":"discard","description":"vec_weight=1.5: no change","metrics":{},"timestamp":1773668636}
{"commit":"4127082","metric":77.50,"status":"discard","description":"bm25=3.0+file_agg=0.02: MRR up but recall down, net loss","metrics":{},"timestamp":1773668660}
{"commit":"4127082","metric":76.81,"status":"discard","description":"chunk_idx=0 boost: recall regression","metrics":{},"timestamp":1773668681}
{"commit":"4127082","metric":77.97,"status":"discard","description":"path depth penalty: penalizes deep MDN paths too much","metrics":{},"timestamp":1773668705}
{"commit":"4127082","metric":73.39,"status":"discard","description":"vec distance bonus 0.15: recall regression 0.90->0.83, vec noise overweights BM25","metrics":{},"timestamp":1773669052}
{"commit":"4127082","metric":76.25,"status":"discard","description":"bm25_weight=3.0 with file_agg+path_reranker: recall regression 0.90->0.87","metrics":{},"timestamp":1773669170}
{"commit":"4127082","metric":79.78,"status":"keep","description":"query term coverage re-ranker 0.10: MRR 0.66->0.70, breaks plateau","metrics":{},"timestamp":1773669246}
{"commit":"92e3dde","metric":80.06,"status":"keep","description":"coverage boost 0.15: MRR 0.70->0.70, marginal improvement","metrics":{},"timestamp":1773669263}
{"commit":"7e9d169","metric":78.19,"status":"discard","description":"coverage boost 0.20: recall regression 0.90->0.87, too aggressive","metrics":{},"timestamp":1773669281}
{"commit":"7e9d169","metric":80.42,"status":"keep","description":"prefix matching in path re-ranker: MRR 0.70->0.71","metrics":{},"timestamp":1773669325}
{"commit":"c24558d","metric":80.56,"status":"keep","description":"file-level coverage union: MRR 0.71->0.71 marginal gain","metrics":{},"timestamp":1773669366}
{"commit":"88910d4","metric":80.97,"status":"keep","description":"title match boost 0.15: MRR 0.71->0.72","metrics":{},"timestamp":1773669413}
{"commit":"045d50b","metric":81.67,"status":"keep","description":"title boost 0.20: MRR 0.72->0.73","metrics":{},"timestamp":1773669437}
{"commit":"53e0fdf","metric":81.67,"status":"discard","description":"title boost 0.25: no change, 0.20 is sweet spot","metrics":{},"timestamp":1773669454}
{"commit":"53e0fdf","metric":81.67,"status":"discard","description":"bigram proximity boost 0.10: no change, exact bigrams too strict","metrics":{},"timestamp":1773669552}
{"commit":"53e0fdf","metric":81.67,"status":"discard","description":"overlap bonus 0.03: no change, most top results already in both lists","metrics":{},"timestamp":1773669622}
{"commit":"53e0fdf","metric":81.67,"status":"discard","description":"heading match boost 0.10: no change","metrics":{},"timestamp":1773669657}
{"commit":"53e0fdf","metric":81.53,"status":"discard","description":"vec_weight=1.5 with re-rankers: MRR slight regression","metrics":{},"timestamp":1773669852}
{"commit":"53e0fdf","metric":81.81,"status":"keep","description":"fusion 15x dedup 8x headroom: MRR 0.7333->0.7361","metrics":{},"timestamp":1773669889}
{"commit":"6ae1712","metric":81.81,"status":"discard","description":"fusion 20x dedup 10x: no additional improvement over 15x/8x","metrics":{},"timestamp":1773669912}
{"commit":"6ae1712","metric":81.53,"status":"discard","description":"length-weighted coverage: regression, overweights long generic terms","metrics":{},"timestamp":1773669947}
{"commit":"6ae1712","metric":81.53,"status":"discard","description":"common prefix >=5: false positive matches cause regression","metrics":{},"timestamp":1773670054}
{"commit":"6ae1712","metric":86.58,"status":"keep","description":"BM25 focused AND clause (top 3 longest terms): recall 0.90->0.97, MRR 0.74->0.77, MASSIVE improvement","metrics":{},"timestamp":1773670125}
{"commit":"b48a9ee","metric":81.53,"status":"discard","description":"AND with top 4 terms: too restrictive, recall drops back to 0.90","metrics":{},"timestamp":1773670148}
{"commit":"b48a9ee","metric":86.67,"status":"keep","description":"path boost 0.30: marginal MRR improvement","metrics":{},"timestamp":1773670234}
{"commit":"b20ef0f","metric":84.58,"status":"discard","description":"title boost 0.25: recall regression 0.97->0.93","metrics":{},"timestamp":1773670252}
{"commit":"b20ef0f","metric":77.08,"status":"discard","description":"NEAR top-4 term pairs: massive regression, too much noise from non-adjacent proximity","metrics":{},"timestamp":1773670293}
{"commit":"b20ef0f","metric":86.67,"status":"discard","description":"coverage boost 0.20: no change","metrics":{},"timestamp":1773670329}
{"commit":"b20ef0f","metric":86.17,"status":"discard","description":"BM25+vec top_k=100: MRR regression, more noise from expanded pool","metrics":{},"timestamp":1773670394}
{"commit":"b20ef0f","metric":85.75,"status":"discard","description":"file agg 0.02: MRR regression, overboosts long files","metrics":{},"timestamp":1773670434}
{"commit":"b20ef0f","metric":82.50,"status":"discard","description":"AND with top 2 terms: too broad, recall+MRR regression","metrics":{},"timestamp":1773670483}
{"commit":"b20ef0f","metric":80.69,"status":"discard","description":"sliding window AND clauses: recall+MRR regression, too much BM25 noise","metrics":{},"timestamp":1773670519}
{"commit":"b20ef0f","metric":86.67,"status":"keep","description":"filter BM25 tokens >2 chars: same quality, faster query (31ms->29ms)","metrics":{},"timestamp":1773670569}
